{
  "resolved_entity_id": "ent_ph_sec_as096003241",
  "crm_account_id": "001Hx000003bQ9AIAU",
  "attribute_name": "registered_legal_name",
  "resolved_value": "Cebu Cement Holdings Inc.",
  "resolved_value_type": "string",
  "attribute_confidence": 97.0,
  "winning_source_id": "national_registry_ph_sec:AS096-003241",
  "survivorship_rule": "sovereign_source_preferred",
  "source_contributions": [
    {
      "source_id": "national_registry_ph_sec:AS096-003241",
      "source_name": "Philippines SEC Registry",
      "source_type": "national_registry",
      "candidate_value": "Cebu Cement Holdings Inc.",
      "source_weight": 0.7,
      "source_confidence": 99.0,
      "last_refreshed_at": "2026-04-24T00:00:00Z",
      "citation": {
        "source_ref_id": "ph-sec-as096-003241",
        "source_url": "https://example.invalid/ph-sec/company/AS096-003241",
        "document_date": "2026-04-24",
        "accessed_at": "2026-04-24T00:00:00Z",
        "excerpt": "Registry record confirms legal entity name."
      },
      "license_or_contract_reference": "public-registry"
    },
    {
      "source_id": "salesforce_crm:001Hx000003bQ9AIAU",
      "source_name": "Salesforce CRM Account",
      "source_type": "crm",
      "candidate_value": "Cebu Cement Holdings Inc.",
      "source_weight": 0.3,
      "source_confidence": 90.0,
      "last_refreshed_at": "2026-04-24T00:00:00Z",
      "citation": {
        "source_ref_id": "sf-account-001Hx000003bQ9AIAU",
        "accessed_at": "2026-04-24T00:00:00Z",
        "excerpt": "CRM Account.Name matches the resolved legal entity."
      }
    }
  ],
  "freshness_status": "fresh",
  "review_required_flag": false,
  "review_reason": "",
  "run_id": "run_20260424_weighted_attributes_001",
  "run_timestamp": "2026-04-24T00:00:00Z",
  "model_version": "weighted-attribute-v1"
}
